{"adapterId":"generic_web","status":"simulated","reason":"synthetic_evidence_verified","declaredSuccess":true,"validatedEvidence":true,"requiredEvidence":["dom","screenshot"],"evidence":[{"kind":"dom","sha256":"aaaaaaaaaaaaaaaaaaaaaaaaaaaaaaaaaaaaaaaaaaaaaaaaaaaaaaaaaaaaaaaa","bytes":120},{"kind":"screenshot","sha256":"bbbbbbbbbbbbbbbbbbbbbbbbbbbbbbbbbbbbbbbbbbbbbbbbbbbbbbbbbbbbbbbb","bytes":999}],"recoveryCount":0,"executionMode":"simulation","missionId":"fixture","externalEffect":false}
